{"task_id":"graphify-discovery-coverage-G1","plan_id":"graphify-discovery-coverage","caller":"orchestrator","callee":"explorer","scope":"Read-only audit exact Graphify inheritance surfaces across agents/skills and enumerate active Sequential Thinking cap-3 locations. Create only required evidence discovery.md.","claim_level":"partial","claim_scope":"Confirmed repo inventory and minimum mechanical audit design.","source_basis":[".opencode/plans/graphify-discovery-coverage.md","AGENTS.md",".opencode/docs/{MCP.md,TOOL_USAGE.md,AGENT_TOOL_ACCESS.md,SKILLS.md}","skills/graphify-discovery/SKILL.md","agents/*.md","skills/opencode-*/SKILL.md","scripts/{agent-boundary-check.mjs,skill-contract-check.mjs}"],"must_preserve":["Graphify optional/local/code-only/read-only; source verification mandatory","Prefer centralized inheritance plus check over copying Graphify prose into each agent/skill","Cap 2 applies non-trivial only, tiny stays 1","No external docs needed: repo policy scope"],"do_not_touch":["All implementation files, config, wrappers, hooks, generated graph, commands/init-harness.md"],"validation":["Count agents and active skills","Verify canonical Graphify chain from AGENTS to docs to dedicated skill","Enumerate every exact cap-3 active file","Recommend minimum existing check extension"],"exit_criteria":["discovery.md has confirmed vs derived surfaces, counts, cap inventory, and minimal check recommendation"],"evidence_required":[".opencode/evidence/graphify-discovery-coverage/discovery.md"],"depends_on":["Plan PASS_FOR_SLICE"],"context_bundle":["Root AGENTS is global rule inheritance; docs MCP/TOOL_USAGE/AGENT_TOOL_ACCESS/SKILLS + graphify skill provide canonical chain","Existing agent/skill checks do not explicitly validate Graphify/cap policy","Do not interpret Graphify source tree as Graphify coverage; only policy contract counts"]}
