{"task_id":"graphify-discovery-coverage-plan-remediation","plan_id":"graphify-discovery-coverage","caller":"orchestrator","callee":"artifact-planner","scope":"Repair plan artifact readiness only. Set explicit maintenance status, fix handoff YAML schema, add mechanically recognized existing-patterns/decisions/confirmed audit labels, and ensure validator uses Maintenance Stability Mode rather than greenfield thresholds. Do not edit implementation docs, skills, scripts, config, generated files, or runtime state.","claim_level":"scoped","claim_scope":"Execution-ready maintenance plan only.","source_basis":["Current plan `.opencode/plans/graphify-discovery-coverage.md`","Validator output in this session","Planning evidence `.opencode/evidence/graphify-discovery-coverage/planning.md`","Canonical maintenance routing policy `.opencode/docs/AGENT_ROUTING.md`"],"must_preserve":["Maintenance Stability Mode proportional depth; do not pad to greenfield thresholds","Graphify optional/local/code-only/read-only and verified-source fallback","Sequential Thinking cap policy exactly 2, tiny path 1, no server-enforcement claim","No implementation edits"],"do_not_touch":["AGENTS.md",".opencode/docs/**","skills/**","scripts/**","opencode.json","graphify-out/**","commands/init-harness.md"],"validation":["python3 scripts/validate-plan-depth.py .opencode/plans/graphify-discovery-coverage.md --mode maintenance --score","python3 scripts/plan-compliance-check.py --project-root . --plan .opencode/plans/graphify-discovery-coverage.md --task-id graphify-discovery-coverage","python3 scripts/subagent-handoff-check.py --plan .opencode/plans/graphify-discovery-coverage.md","python3 scripts/plan-execution-readiness.py .opencode/plans/graphify-discovery-coverage.md --project-root ."],"exit_criteria":["Plan is PASS or PASS_FOR_SLICE, says status explicitly, all embedded handoffs are schema-valid at block root, and supports exact bounded implementation"],"evidence_required":["Append remediation results to `.opencode/evidence/graphify-discovery-coverage/planning.md`"],"depends_on":["Initial plan validator NEEDS_DEPTH output"],"context_bundle":["Current plan already has sections but lacks `Status:` and wraps payloads under `handoff:`. Validator auto wrongly selected greenfield despite explicit Maintenance mode. Use explicit `--mode maintenance` to prove proportional readiness. Do not expand plan into 5000-line greenfield artifact."]}
