{"task_id":"graphify-opencode-integration","plan_id":"graphify-opencode-integration","caller":"orchestrator","callee":"fixer","scope":"Add Graphify-specific skill and inherited query-first policy guidance for agents/skills. Do not install packages or change opencode.json.","claim_level":"scoped","claim_scope":"Prompt, docs, and skill guidance only.","source_basis":[".opencode/plans/graphify-opencode-integration.md",".opencode/evidence/graphify-opencode-integration/source-audit.md","AGENTS.md",".opencode/docs/{MCP.md,TOOL_USAGE.md,AGENT_TOOL_ACCESS.md,SKILLS.md}"],"must_preserve":["Graphify is optional read-only discovery context","Graph query never replaces source verification/tests/runtime checks","INFERRED and AMBIGUOUS edges are non-factual leads","Fallback to normal repo discovery when graph missing/stale","No Graphify upstream installer/plugin/hook/semantic LLM/HTTP","Do not touch commands/init-harness.md"],"do_not_touch":["opencode.json","scripts/graphify-*","package.json","commands/init-harness.md","pre-existing user changes"],"validation":["npm run check:docs","npm run check:agents","npm run check:skills","grep all active skills/agents inherit AGENTS guidance"],"exit_criteria":["Dedicated Graphify skill exists; root AGENTS guidance and MCP/tool docs make query-first protocol available to every agent/skill; evidence written"],"evidence_required":[".opencode/evidence/graphify-opencode-integration/guidance-audit.md"],"depends_on":["G1"],"context_bundle":["All agents inherit root AGENTS.md","Current skills are local skills/*/SKILL.md","Graphify upstream supports query/path/explain and OpenCode skill reference","Need fast prescan before broad repo discovery but no hard blocking"]}
