{"task_id":"graphify-opencode-integration","plan_id":"graphify-opencode-integration","caller":"orchestrator","callee":"devops","scope":"Install Graphify MCP extra; create code-only startup wrapper; add global local MCP config. Do not touch policy docs/AGENTS/skills.","claim_level":"scoped","claim_scope":"Runtime tooling/config only.","source_basis":[".opencode/plans/graphify-opencode-integration.md",".opencode/evidence/graphify-opencode-integration/source-audit.md","opencode.json"],"must_preserve":["Code-only extraction only","No hooks, plugins, HTTP transport, semantic extraction, secrets, hardcoded home paths","MCP must run against OpenCode project cwd","Do not touch commands/init-harness.md"],"do_not_touch":["AGENTS.md",".opencode/docs/*","skills/*","commands/init-harness.md","pre-existing user changes"],"validation":["uv tool install graphifyy[mcp]","graphify --version","startup wrapper with temp/project graph","graphify query","graphify-mcp stdio handshake or help probe","python JSON parse opencode.json"],"exit_criteria":["Graphify available globally; wrapper safely builds/updates local code-only graph; opencode.json declares enabled local MCP using wrapper; evidence written"],"evidence_required":[".opencode/evidence/graphify-opencode-integration/install-and-runtime.md"],"depends_on":["G1"],"context_bundle":["Upstream installer rejected because global install writes local plugin/config","Context7 confirms local MCP cwd defaults to active instance project directory","Use `graphify-mcp` entrypoint from uv tool after installation","No semantic LLM extraction or network listener"]}
