{"task_id":"graphify-discovery-coverage-G2-G3","plan_id":"graphify-discovery-coverage","caller":"orchestrator","callee":"fixer","scope":"Implement G2+G3: enforce centralized Graphify coverage mechanically for all agent/skill contracts, lower every active Sequential Thinking cap from 3 to 2, refresh derived docs, and write implementation/verification evidence. Bounded policy/check changes only.","claim_level":"partial","claim_scope":"Graphify inheritance audit and Sequential Thinking prompt cap policy only.","source_basis":[".opencode/plans/graphify-discovery-coverage.md",".opencode/evidence/graphify-discovery-coverage/discovery.md","AGENTS.md",".opencode/docs/{MCP.md,TOOL_USAGE.md,AGENT_TOOL_ACCESS.md,SKILLS.md}","skills/graphify-discovery/SKILL.md","scripts/{agent-boundary-check.mjs,skill-contract-check.mjs,generate-generated-docs.mjs}","package.json"],"must_preserve":["Graphify optional/local/code-only/read-only discovery; query-first only broad fresh graph; INFERRED/AMBIGUOUS leads; source/tests/runtime mandatory","Centralized Graphify inheritance, no copying Graphify prose into every agent/skill","All 23 agent files and 23 active opencode skill files covered by mechanical check","Sequential Thinking cap exactly 2 for non-trivial/ambiguous/risky; tiny remains 1; no claim server-enforced","Reuse existing check scripts; generated MCP matrix remains derived"],"do_not_touch":["opencode.json","scripts/graphify-mcp-wrapper",".git/hooks/**","graphify-out/**","commands/init-harness.md","secrets/env","unrelated .opencode/state graphify-opencode-integration files"],"validation":["npm run check:agents","npm run check:skills","npm run docs:generate","npm run docs:generate:check","npm run check:docs","grep cap-3 active policy surfaces returns no matches","Graphify specific coverage assertion runs via existing checks","git diff --check"],"exit_criteria":["All caps lowered; audit fails if AGENTS/docs/Graphify skill absent or any local agent/skill missing centralized inheritance reference; checks pass; evidence files written"],"evidence_required":[".opencode/evidence/graphify-discovery-coverage/implementation-notes.md",".opencode/evidence/graphify-discovery-coverage/verification.md"],"depends_on":["G1 discovery complete"],"context_bundle":["G1 confirmed 23 agent files, 23 active opencode skill files; 22 cap-3 refs: 3 canonical docs, 1 derived, 18 skills","Do not add Graphify content to individual agent/skill prompt files; use check to assert AGENTS global rule and canonical docs plus all counts","Check scripts currently have no coverage assertions; add minimum robust assertions in existing scripts; document coverage in SKILLS if needed"]}
