{"task_id":"graphify-discovery-coverage-G4","plan_id":"graphify-discovery-coverage","caller":"orchestrator","callee":"quality-gate","scope":"Read-only final conformance review for centralized Graphify inheritance coverage and Sequential Thinking cap-2 policy.","claim_level":"partial","claim_scope":"Policy/docs/check slice only; no server capability claim.","source_basis":[".opencode/plans/graphify-discovery-coverage.md",".opencode/evidence/graphify-discovery-coverage/{discovery.md,implementation-notes.md,verification.md}","canonical docs, active skills, check scripts, generated matrix"],"must_preserve":["Graphify remains optional/local/code-only/read-only; direct verification mandatory","No Graphify prose copied into every agent/skill","Every current agent and active skill checked via centralized chain","Cap 2 non-trivial and tiny 1; prompt-policy only","Generated docs derived/current","Exclude unrelated commands/init-harness.md, Graphify generated output, older integration state"],"do_not_touch":["All files; review only"],"validation":["npm run check:agents","npm run check:skills","npm run docs:generate:check","npm run check:docs","cap-3 absence command using safe variable name","git diff --check","diff boundary review","plan compliance and tracker summary"],"exit_criteria":["PASS or explicit remediation; exact commit eligible paths; no false assertion about all agents if audit incomplete"],"evidence_required":[".opencode/evidence/graphify-discovery-coverage/quality-gate.md"],"depends_on":["G2 and G3 complete"],"context_bundle":["Current check scripts enumerate all current files instead of hardcoding 23 (observed 23 today)","All 18 active skill cap snippets changed, canonical docs + registry updated then generated docs refreshed","Do not treat global AGENTS inheritance as Graphify content in agent files; audit is centralized by design"]}
