{"task_id":"graphify-opencode-integration","plan_id":"graphify-opencode-integration","caller":"orchestrator","callee":"devops","scope":"One-file remediation in opencode.json: remove `{env:PWD}` argument from Graphify MCP command so wrapper uses OpenCode-provided active instance cwd (`$PWD`).","claim_level":"partial","claim_scope":"Portable startup root resolution.","source_basis":["Context7 /anomalyco/opencode local MCP source: local process cwd defaults to InstanceState.directory","opencode.json graphify entry","scripts/graphify-mcp-wrapper"],"must_preserve":["Keep local stdio MCP, wrapper path using {env:HOME}, enabled true, timeout 120000","No plugins/hooks/HTTP/semantic extraction/secrets","Do not touch commands/init-harness.md"],"do_not_touch":["All other opencode.json entries","docs","AGENTS.md","skills","scripts/graphify-mcp-wrapper","commands/init-harness.md"],"validation":["python3 -m json.tool opencode.json","verify Graphify command contains exactly bash + wrapper path and no {env:PWD}"],"exit_criteria":["MCP wrapper relies on default OpenCode active project cwd, not unverified environment interpolation"],"evidence_required":["Append remediation note to .opencode/evidence/graphify-opencode-integration/install-and-runtime.md"],"depends_on":["G2"],"context_bundle":["Context7 documented StdioClientTransport cwd: mcp.cwd resolved relative to base directory, otherwise baseDir = active instance directory","Wrapper defaults root=${1:-$PWD}","Current config incorrectly passes {env:PWD}; remove only this command argument"]}
