{"task_id":"graphify-opencode-integration","plan_id":"graphify-opencode-integration","caller":"orchestrator","callee":"artifact-planner","scope":"Remediate only plan and plan-linked evidence to satisfy plan-depth gate. No source/config/docs/skill edits.","claim_level":"partial","claim_scope":"Execution-plan readiness for completed Graphify integration.","source_basis":[".opencode/plans/graphify-opencode-integration.md",".opencode/evidence/graphify-opencode-integration/quality-gate.md",".opencode/evidence/graphify-opencode-integration/{source-audit.md,install-and-runtime.md,guidance-audit.md}"],"must_preserve":["Existing actual implementation scope only","Code-only/local/no hooks/plugins/HTTP/semantic extraction","No edits outside plan/evidence","Missing PROJECT_* docs exception: this task does not create framework-managed artifacts; record waiver, do not fabricate docs"],"do_not_touch":["opencode.json","AGENTS.md",".opencode/docs/*","scripts/*","skills/*","commands/init-harness.md"],"validation":["python3 scripts/validate-plan-depth.py .opencode/plans/graphify-opencode-integration.md --mode auto --score","python3 scripts/subagent-handoff-check.py --plan .opencode/plans/graphify-opencode-integration.md"],"exit_criteria":["Plan has explicit goal, non-goals, >=8 requirements, >=6 acceptance criteria, >=4 ordered implementation steps, >=3 validation commands, confirmed/assumed grounding, and evidence requirements; depth check passes"],"evidence_required":["Append plan remediation note to .opencode/evidence/graphify-opencode-integration/quality-gate.md or new plan-remediation.md"],"depends_on":["G4 needs-fix"],"context_bundle":["Quality gate returned NEEDS_FIX only for plan-depth; runtime/doc checks already pass","Plan must reflect completed real behavior, not new behavior","PROJECT_* docs missing: waived because no framework artifacts; record as limited scope not claim they exist"]}
