{"task_id":"graphify-opencode-integration","plan_id":"graphify-opencode-integration","caller":"orchestrator","callee":"quality-gate","scope":"Read-only quality-gate rerun after plan-depth remediation. Review only; do not edit.","claim_level":"partial","claim_scope":"Graphify preset integration.","source_basis":[".opencode/plans/graphify-opencode-integration.md",".opencode/evidence/graphify-opencode-integration/{quality-gate.md,plan-remediation.md,source-audit.md,install-and-runtime.md,guidance-audit.md}"],"must_preserve":["Code-only local Graphify","No plugins/hooks/HTTP/semantic extraction/secrets","Graph outputs never replace verification","commands/init-harness.md excluded"],"do_not_touch":["All files; review only"],"validation":["Confirm plan depth/compliance/handoff passes","Review wrapper/config/guidance/runtime evidence","Verify project docs waiver matches scope","Return final PASS or exact residual risks"],"exit_criteria":["PASS or PASS_WITH_RISKS justified by evidence"],"evidence_required":["Append rerun verdict to .opencode/evidence/graphify-opencode-integration/quality-gate.md"],"depends_on":["plan remediation complete"],"context_bundle":["Plan depth 100% EXECUTION_READY confirmed runtime","Plan compliance PASS confirmed runtime","Handoff check PASS confirmed runtime","Missing PROJECT_* docs waived as no framework artifacts were created","OpenCode restart still required before actual config reload"]}
